{
  "schemaVersion": 1,
  "id": "typescript-eslint",
  "label": "TypeScript com ESLint",
  "description": "Roda o ESLint com a configuração do projeto nos componentes TypeScript e JavaScript. Entra por evidência: só quando há um eslint.config (flat config) na raiz de um componente ou do workspace; sem ele, o ESLint não aparece no plano.",
  "extends": [
    "builtin:base"
  ],
  "match": {
    "languages": [
      "typescript",
      "javascript"
    ],
    "files": [
      "eslint.config.js",
      "eslint.config.mjs",
      "eslint.config.cjs",
      "eslint.config.ts",
      "eslint.config.mts",
      "eslint.config.cts"
    ]
  },
  "config": {
    "tools": {
      "eslint": {
        "adapter": "eslint",
        "enabled": true,
        "capabilities": [
          "lint"
        ]
      }
    }
  }
}
